Symbol,Name,Last Sale,Net Change,% Change,Market Cap,Country,IPO Year,Volume,Sector,Industry
CSIQ,Canadian Solar Inc. Common Shares (BC),$38.69,-0.03,-0.077%,2321308808.00,China,2006,2550952,,
CSOD,Cornerstone OnDemand Inc. Common Stock,$51.76,0.45,0.877%,3426490313.00,United States,2011,228342,Technology,Computer Software: Prepackaged Software
CSPI,CSP Inc. Common Stock,$11.60,0.1596,1.395%,50970006.00,United States,1982,4065,Technology,EDP Services
CSQ,Calamos Strategic Total Return Common Stock,$18.04,0.15,0.838%,2799776520.00,United States,2004,156656,Finance,Finance Companies
CSSE,Chicken Soup for the Soul Entertainment Inc. Class A Common Stock,$41.39,2.40,6.155%,523537888.00,United States,2017,126725,Consumer Services,Movies/Entertainment
CSSEN,Chicken Soup for the Soul Entertainment Inc. 9.50% Notes due 2025,$26.6704,0.1704,0.643%,0.00,United States,,1247,Consumer Services,Movies/Entertainment
CSSEP,Chicken Soup for the Soul Entertainment Inc. 9.75% Series A Cumulative Redeemable Perpetual Preferred Stock,$28.00,0.11,0.394%,0.00,United States,,9736,Consumer Services,Movies/Entertainment
CSTE,Caesarstone Ltd. Ordinary Shares,$14.66,0.01,0.068%,504909766.00,Israel,2012,101881,Capital Goods,Multi-Sector Companies
CSTL,Castle Biosciences Inc. Common Stock,$75.09,0.41,0.549%,1881485902.00,United States,2019,274334,Health Care,Medical Specialities
CSTR,CapStar Financial Holdings Inc. Common Stock,$20.94,0.10,0.48%,462661720.00,United States,2016,88034,Finance,Major Banks
CSWC,Capital Southwest Corporation Common Stock,$24.93,-0.16,-0.638%,524118946.00,United States,,120026,Finance,Finance/Investors Services
CSWI,CSW Industrials Inc. Common Stock,$117.71,1.46,1.256%,1846574330.00,United States,,31281,Basic Industries,Home Furnishings
CSX,CSX Corporation Common Stock,$95.15,0.49,0.518%,216200107838.00,United States,,4140342,Transportation,Railroads
CTAQ,Carney Technology Acquisition Corp. II Class A Common Stock,$9.71,-0.02,-0.206%,497273375.00,United States,2021,13300,,
CTAQU,Carney Technology Acquisition Corp. II Units,$10.00,0.00,0.00%,0.00,United States,2020,109817,,
CTAQW,Carney Technology Acquisition Corp. II Warrant,$0.8903,0.0003,0.034%,0.00,United States,2021,15260,Finance,Business Services
CTAS,Cintas Corporation Common Stock,$377.80,2.02,0.538%,39689097827.00,United States,1983,418831,Miscellaneous,Business Services
CTBI,Community Trust Bancorp Inc. Common Stock,$41.07,0.52,1.282%,732338843.00,United States,,33335,Finance,Major Banks
CTG,Computer Task Group Inc. Common Stock,$9.76,0.20,2.092%,150089953.00,United States,,21550,Technology,EDP Services
CTHR,Charles & Colvard Ltd Common Stock,$3.07,0.17,5.862%,91648557.00,United States,1997,427101,Consumer Services,Consumer Specialties
CTIB,Yunhong CTI Ltd. Common Stock,$1.90,0.07,3.825%,8539755.00,United States,1997,586599,Miscellaneous,Diversified Commercial Services
CTIC,CTI BioPharma Corp. (DE) Common Stock,$2.34,0.01,0.429%,218280376.00,United States,1997,401085,Health Care,Major Pharmaceuticals
CTLP,Cantaloupe Inc. Common Stock,$12.67,0.14,1.117%,900980336.00,United States,,483825,Technology,EDP Services
CTMX,CytomX Therapeutics Inc. Common Stock,$6.70,0.02,0.299%,435574571.00,United States,2015,726918,Health Care,Major Pharmaceuticals
CTRE,CareTrust REIT Inc. Common Stock,$23.66,0.44,1.895%,2289935371.00,United States,,428173,Consumer Services,Real Estate Investment Trusts
CTRM,Castor Maritime Inc. Common Shares,$2.75,-0.02,-0.722%,247378582.00,Cyprus,,7387358,Transportation,Marine Transportation
CTRN,Citi Trends Inc. Common Stock,$82.81,-0.80,-0.957%,766315542.00,United States,2005,239849,,
CTSH,Cognizant Technology Solutions Corporation Class A Common Stock,$69.82,0.71,1.027%,36823897741.00,United States,1998,2612141,Technology,EDP Services
CTSO,Cytosorbents Corporation Common Stock,$7.84,0.07,0.901%,338357771.00,United States,,107236,Health Care,Medical/Dental Instruments
CTXR,Citius Pharmaceuticals Inc. Common Stock,$3.94,-0.04,-1.005%,533767351.00,United States,,9981626,Health Care,Major Pharmaceuticals
CTXRW,Citius Pharmaceuticals Inc. Warrant,$1.85,-0.12,-6.091%,0.00,United States,,13846,Health Care,Major Pharmaceuticals
CTXS,Citrix Systems Inc. Common Stock,$114.52,1.18,1.041%,14219609993.00,United States,1995,814960,Technology,Computer Software: Prepackaged Software
CUBA,Herzfeld Caribbean Basin Fund Inc. (The) Common Stock,$6.21,0.11,1.803%,38090060.00,United States,,9100,Finance,Investment Managers
CUE,Cue Biopharma Inc. Common Stock,$13.35,0.52,4.053%,407194611.00,United States,2018,201896,Health Care,Major Pharmaceuticals
CUEN,Cuentas Inc. Common Stock,$2.36,0.17,7.763%,32637858.00,United States,,194078,Technology,Computer Software: Prepackaged Software
CUENW,Cuentas Inc. Warrant,$0.60,0.1002,20.048%,0.00,United States,,667,Miscellaneous,Business Services
CURI,CuriosityStream Inc. Class A Common Stock,$13.96,-0.06,-0.428%,733824696.00,United States,2020,540070,Consumer Services,Broadcasting
CURIW,CuriosityStream Inc. Warrant,$4.60,-0.20,-4.167%,0.00,United States,2020,4191,Consumer Services,Movies/Entertainment
CUTR,Cutera Inc. Common Stock,$47.33,0.89,1.916%,842628958.00,United States,2004,187363,Health Care,Biotechnology: Electromedical & Electrotherapeutic Apparatus
CVAC,CureVac N.V. Ordinary Shares,$59.76,2.85,5.008%,11128496204.00,Germany,2020,1046888,Health Care,Major Pharmaceuticals
CVBF,CVB Financial Corporation Common Stock,$21.43,0.38,1.805%,2912743570.00,United States,,349090,Finance,Major Banks
CVCO,Cavco Industries Inc. Common Stock When Issued,$220.17,2.15,0.986%,2020508016.00,United States,,26182,Basic Industries,Homebuilding
CVCY,Central Valley Community Bancorp Common Stock,$19.96,0.33,1.681%,250090996.00,United States,,92252,Finance,Major Banks
CVET,Covetrus Inc. Common Stock,$27.53,0.72,2.686%,3760306292.00,United States,,508015,Health Care,Managed Health Care
CVGI,Commercial Vehicle Group Inc. Common Stock,$11.10,-0.02,-0.18%,365588756.00,United States,2004,366563,Capital Goods,Auto Parts:O.E.M.
CVGW,Calavo Growers Inc. Common Stock,$63.99,0.33,0.518%,1131594681.00,United States,,119114,Consumer Non-Durables,Specialty Foods
CVLG,Covenant Logistics Group Inc. Class A Common Stock,$20.90,0.29,1.407%,350117051.00,United States,,41568,Transportation,Trucking Freight/Courier Services
CVLT,Commvault Systems Inc. Common Stock,$81.04,0.63,0.783%,3729966733.00,United States,2006,158422,Technology,Computer Software: Prepackaged Software
CVLY,Codorus Valley Bancorp Inc Common Stock,$20.00,0.20,1.01%,197533840.00,United States,,99762,Finance,Savings Institutions
CVV,CVD Equipment Corporation Common Stock,$4.29,0.05,1.179%,28675565.00,United States,,33992,Technology,Industrial Machinery/Components
CWBC,Community West Bancshares Common Stock,$13.00,-0.18,-1.366%,110843369.00,United States,,10788,Finance,Major Banks
CWBR,CohBar Inc. Common Stock,$1.23,0.01,0.82%,75999640.00,United States,,581339,Health Care,Biotechnology: In Vitro & In Vivo Diagnostic Substances
CWCO,Consolidated Water Co. Ltd. Ordinary Shares,$12.35,-0.04,-0.323%,187738216.00,Cayman Islands,,137035,Public Utilities,Water Supply
CWST,Casella Waste Systems Inc. Class A Common Stock,$64.36,0.29,0.453%,3305744048.00,United States,1997,106742,Public Utilities,Environmental Services
CXDC,China XD Plastics Company Limited Common Stock,$0.5902,0.0049,0.837%,41637926.00,China,,349864,Consumer Non-Durables,Plastic Products
CXDO,Crexendo Inc. Common Stock,$6.37,0.43,7.239%,137225056.00,United States,,79732,Consumer Services,Telecommunications Equipment
CYAD,Celyad Oncology SA American Depositary Shares,$5.50,0.20,3.774%,82528358.00,Belgium,2015,4076,Health Care,Major Pharmaceuticals
CYAN,Cyanotech Corporation Common Stock,$2.83,-0.0119,-0.419%,17254717.00,United States,,26296,Consumer Non-Durables,Farming/Seeds/Milling
CYBE,CyberOptics Corporation Common Stock,$39.04,2.63,7.223%,284967639.00,United States,1987,181252,Capital Goods,Electronic Components
CYBR,CyberArk Software Ltd. Ordinary Shares,$134.64,-1.42,-1.044%,5353240892.00,Israel,2014,402203,Technology,Computer Software: Prepackaged Software
CYCC,Cyclacel Pharmaceuticals Inc. Common Stock,$6.42,-0.08,-1.231%,59282986.00,United States,,40385,Health Care,Major Pharmaceuticals
CYCCP,Cyclacel Pharmaceuticals Inc. 6% Convertible Preferred Stock,$9.80,0.42,4.478%,0.00,United States,,205,Health Care,Major Pharmaceuticals
CYCN,Cyclerion Therapeutics Inc. Common Stock,$3.97,0.21,5.585%,160471009.00,United States,,1636225,Health Care,Major Pharmaceuticals
CYRN,CYREN Ltd. Ordinary Shares,$0.7241,0.0223,3.178%,54771072.00,United States,,625960,Technology,Computer Software: Prepackaged Software
CYRX,CryoPort Inc. Common Stock,$64.31,-1.10,-1.682%,2937774435.00,United States,,346888,,
CYT,Cyteir Therapeutics Inc. Common Stock,$17.46,0.66,3.929%,601786522.00,United States,2021,147565,,
CYTH,Cyclo Therapeutics Inc. Common Stock,$10.85,0.18,1.687%,68991472.00,United States,,173262,Health Care,Major Pharmaceuticals
CYTHW,Cyclo Therapeutics Inc. Warrant,$5.9466,0.5466,10.122%,0.00,United States,,3832,Basic Industries,Major Chemicals
CYTK,Cytokinetics Incorporated Common Stock,$22.55,0.24,1.076%,1617695125.00,United States,2004,371842,Health Care,Major Pharmaceuticals
CZNC,Citizens & Northern Corp Common Stock,$25.22,-0.05,-0.198%,403578384.00,United States,,32051,Finance,Major Banks
CZR,Caesars Entertainment Inc. Common Stock,$104.73,1.51,1.463%,21857006787.00,United States,,2076344,Consumer Services,Hotels/Resorts
CZWI,Citizens Community Bancorp Inc. Common Stock,$13.585,-0.115,-0.839%,147920993.00,United States,,6207,Finance,Savings Institutions
DADA,Dada Nexus Limited American Depositary Shares,$31.45,1.45,4.833%,7447156770.00,China,2020,948521,Consumer Services,Department/Specialty Retail Stores
DAIO,Data I/O Corporation Common Stock,$7.09,0.24,3.504%,59746459.00,United States,1981,129966,Capital Goods,Industrial Machinery/Components
DAKT,Daktronics Inc. Common Stock,$6.63,0.06,0.913%,299320685.00,United States,1994,122548,Capital Goods,Office Equipment/Supplies/Services
DARE,Dare Bioscience Inc. Common Stock,$1.46,0.00,0.00%,72051112.00,United States,2014,2802876,Health Care,Major Pharmaceuticals
DAWN,Day One Biopharmaceuticals Inc. Common Stock,$20.14,-0.09,-0.445%,1247248831.00,United States,2021,25789,Health Care,Major Pharmaceuticals
DBDR,Roman DBDR Tech Acquisition Corp. Class A Common Stock,$10.10,-0.04,-0.394%,292344500.00,United States,2020,12619,,
DBDRU,Roman DBDR Tech Acquisition Corp. Unit,$10.85,0.00,0.00%,0.00,United States,2020,1069,,
DBDRW,Roman DBDR Tech Acquisition Corp. Warrant,$1.553,0.003,0.194%,0.00,United States,2020,26299,Finance,Business Services
DBGI,Digital Brands Group Inc. Common Stock,$5.36,1.27,31.051%,56241081.00,United States,2021,73698150,Consumer Services,Clothing/Shoe/Accessory Stores
DBGIW,Digital Brands Group Inc. Warrant,$1.55,0.601,63.33%,0.00,United States,2021,797877,Consumer Non-Durables,Apparel
DBTX,Decibel Therapeutics Inc. Common Stock,$7.77,-0.29,-3.598%,193488004.00,United States,2021,82762,Health Care,Major Pharmaceuticals
DBVT,DBV Technologies S.A. American Depositary Shares,$5.73,-0.03,-0.521%,629651513.00,France,2014,47649,Health Care,Biotechnology: Biological Products (No Diagnostic Substances)
DBX,Dropbox Inc. Class A Common Stock,$29.84,0.08,0.269%,11663783585.00,United States,2018,3111152,Technology,Computer Software: Prepackaged Software
DCBO,Docebo Inc. Common Shares,$56.82,0.23,0.406%,1857690637.00,Canada,,51162,,
DCOM,Dime Community Bancshares Inc. Common Stock,$35.00,0.80,2.339%,1455434295.00,United States,,189967,Finance,Savings Institutions
DCOMP,Dime Community Bancshares Inc. Fixed-Rate Non-Cumulative Perpetual Preferred Stock Series A,$25.87,0.07,0.271%,0.00,United States,,8937,Finance,Savings Institutions
DCPH,Deciphera Pharmaceuticals Inc. Common Stock,$35.95,0.09,0.251%,2083823631.00,United States,2017,481545,Health Care,Major Pharmaceuticals
DCRB,Decarbonization Plus Acquisition Corporation Class A Common Stock,$10.34,0.11,1.075%,291749583.00,United States,2020,237874,Energy,Industrial Machinery/Components
DCRBU,Decarbonization Plus Acquisition Corporation Unit,$11.45,0.0812,0.714%,0.00,United States,2020,3500,Energy,Industrial Machinery/Components
DCRBW,Decarbonization Plus Acquisition Corporation Warrant,$2.20,0.09,4.265%,0.00,United States,2020,71809,Energy,Industrial Machinery/Components
DCRC,Decarbonization Plus Acquisition Corporation III Class A Common Stock,$10.38,-0.15,-1.425%,454125000.00,United States,2021,1042418,Finance,Business Services
DCRCU,Decarbonization Plus Acquisition Corporation III Unit,$11.25,-0.20,-1.747%,0.00,United States,2021,82761,,
DCRCW,Decarbonization Plus Acquisition Corporation III Warrant,$2.55,-0.14,-5.204%,0.00,United States,2021,128256,Finance,Business Services
DCRN,Decarbonization Plus Acquisition Corporation II Class A Common stock,$9.87,0.01,0.101%,496584375.00,United States,2021,301144,,
DCRNU,Decarbonization Plus Acquisition Corporation II Unit,$10.28,0.01,0.097%,0.00,United States,2021,35174,,
DCRNW,Decarbonization Plus Acquisition Corporation II Warrant,$1.27,-0.005,-0.392%,0.00,United States,2021,156983,Finance,Business Services
DCT,Duck Creek Technologies Inc. Common Stock,$42.62,2.67,6.683%,5608320708.00,United States,2020,546163,Technology,Retail: Computer Software & Peripheral Equipment
DCTH,Delcath Systems Inc. Common Stock,$11.04,0.58,5.545%,71455274.00,United States,,63595,Health Care,Medical Specialities
DDMX,DD3 Acquisition Corp. II Class A Common Stock,$9.9617,0.0117,0.118%,71955351.00,Mexico,2021,15631,Finance,Business Services
DDMXU,DD3 Acquisition Corp. II Unit,$10.75,0.00,0.00%,0.00,Mexico,2020,1047,Finance,Business Services
DDMXW,DD3 Acquisition Corp. II Warrant,$1.54,-0.04,-2.532%,0.00,Mexico,2021,27739,Finance,Business Services
DDOG,Datadog Inc. Class A Common Stock,$106.44,-0.09,-0.084%,32824334312.00,United States,2019,2861867,Technology,Computer Software: Prepackaged Software
DENN,Denny's Corporation Common Stock,$17.28,0.40,2.37%,1108422922.00,United States,,380104,Consumer Services,Restaurants
DFFN,Diffusion Pharmaceuticals Inc. Common Stock,$0.789,-0.028,-3.427%,80402239.00,United States,,964622,Health Care,Major Pharmaceuticals
DFH,Dream Finders Homes Inc. Class A Common Stock,$23.47,-0.56,-2.33%,2171479183.00,United States,2021,296824,,
DFPH,DFP Healthcare Acquisitions Corp. Class A Common Stock,$10.00,0.00,0.00%,287500000.00,United States,2020,11588,Finance,Major Banks
DGICA,Donegal Group Inc. Class A Common Stock,$15.11,0.09,0.599%,466353378.00,United States,,74256,Finance,Property-Casualty Insurers
DGICB,Donegal Group Inc. Class B Common Stock,$15.00,0.00,0.00%,462958350.00,United States,1986,57,Finance,Property-Casualty Insurers
DGII,Digi International Inc. Common Stock,$20.06,0.57,2.925%,682632091.00,United States,1989,157069,Technology,Computer peripheral equipment
DGLY,Digital Ally Inc. Common Stock,$1.81,-0.03,-1.63%,93239781.00,United States,,1126269,Technology,Radio And Television Broadcasting And Communications Equipment
DGNS,Dragoneer Growth Opportunities Corp. II Class A Ordinary Shares,$10.34,0.00,0.00%,364505680.00,United States,2020,5016,Finance,Business Services
DGNU,Dragoneer Growth Opportunities Corp. III Class A Ordinary Shares,$10.03,0.00,0.00%,501500000.00,United States,2021,172622,Finance,Business Services
DHBC,DHB Capital Corp. Class A common stock,$9.71,0.00,0.00%,348953125.00,United States,2021,4,,
DHBCU,DHB Capital Corp. Unit,$9.96,0.01,0.101%,357937500.00,United States,2021,4797,Finance,Business Services
DHBCW,DHB Capital Corp. Warrant,$0.76,0.02,2.703%,0.00,United States,2021,5330,,
DHC,Diversified Healthcare Trust Common Shares of Beneficial Interest,$4.08,0.02,0.493%,972135390.00,United States,,882116,Consumer Services,Real Estate Investment Trusts
DHCA,DHC Acquisition Corp. Class A ordinary share,$9.69,-0.01,-0.103%,374276250.00,United States,2021,10648,Finance,Business Services
DHCAU,DHC Acquisition Corp. Unit,$9.96,0.00,0.00%,0.00,United States,2021,50,Finance,Business Services
DHCAW,DHC Acquisition Corp. Warrant,$0.9288,-0.1412,-13.196%,0.00,United States,2021,13352,Finance,Business Services
DHCNI,Diversified Healthcare Trust 5.625% Senior Notes due 2042,$24.045,0.005,0.021%,0.00,United States,,10619,Consumer Services,Real Estate Investment Trusts
DHCNL,Diversified Healthcare Trust 6.25% Senior Notes Due 2046,$25.03,-0.0109,-0.044%,0.00,United States,,12171,Consumer Services,Real Estate Investment Trusts
DHHC,DiamondHead Holdings Corp. Class A Common Stock,$9.71,0.00,0.00%,418743750.00,United States,2021,858,,
DHHCU,DiamondHead Holdings Corp. Unit,$9.99,0.04,0.402%,0.00,United States,2021,98647,,
DHHCW,DiamondHead Holdings Corp. Warrant,$1.01,0.01,1.00%,0.00,United States,2021,25000,Finance,Business Services
DHIL,Diamond Hill Investment Group Inc. Class A Common Stock,$172.19,3.19,1.888%,549962807.00,United States,,3643,Finance,Investment Managers
DIBS,1stdibs.com Inc. Common Stock,$25.00,-1.94,-7.201%,936463125.00,United States,2021,114385,,
DILAU,DILA Capital Acquisition Corp. Unit,$9.9846,-0.0354,-0.353%,0.00,Mexico,2021,27700,,
DIOD,Diodes Incorporated Common Stock,$78.01,1.64,2.147%,3480549937.00,United States,,127002,Technology,Semiconductors
DISA,Disruptive Acquisition Corporation I Class A Ordinary Shares,$9.77,0.07,0.722%,335843750.00,United States,2021,4135,Finance,Business Services
DISAU,Disruptive Acquisition Corporation I Unit,$9.9458,0.0158,0.159%,0.00,United States,2021,2028,Finance,Business Services
DISAW,Disruptive Acquisition Corporation I Warrant,$0.86,0.01,1.176%,0.00,United States,2021,14146,Finance,Business Services
DISCA,Discovery Inc. Series A Common Stock,$30.32,0.81,2.745%,15323952580.00,United States,,6665941,Consumer Services,Television Services
DISCB,Discovery Inc. Series B Common Stock,$64.90,-4.44,-6.403%,32800940714.00,United States,,4283,Consumer Services,Television Services
DISCK,Discovery Inc. Series C Common Stock,$28.65,0.84,3.02%,14479922211.00,United States,,3095791,Consumer Services,Television Services
DISH,DISH Network Corporation Class A Common Stock,$41.19,0.74,1.829%,21736150703.00,United States,1995,1675828,Consumer Services,Television Services
DJCO,Daily Journal Corp. (S.C.) Common Stock,$338.40,1.60,0.475%,467244446.00,United States,,839,Consumer Services,Newspapers/Magazines
DKDCA,Data Knights Acquisition Corp. Class A Common Stock,$9.90,9.90,,,United Kingdom,,664300,,
DKDCU,Data Knights Acquisition Corp. Unit,$10.37,0.17,1.667%,0.00,United Kingdom,2021,100171,,
DKDCW,Data Knights Acquisition Corp. Warrant,$0.50,0.50,,,United Kingdom,,1340403,,
DKNG,DraftKings Inc. Class A Common Stock,$51.06,0.53,1.049%,20507938862.00,United States,2019,11037958,Consumer Services,Services-Misc. Amusement & Recreation
DLCA,Deep Lake Capital Acquisition Corp. Class A Ordinary Shares,$9.68,0.00,0.00%,250470000.00,United States,2021,1819,Finance,Business Services
DLCAU,Deep Lake Capital Acquisition Corp. Unit,$10.03,0.00,0.00%,0.00,United States,2021,189,Finance,Business Services
DLCAW,Deep Lake Capital Acquisition Corp. Warrant,$0.8098,0.0498,6.553%,0.00,United States,2021,12005,Finance,Business Services
DLHC,DLH Holdings Corp.,$11.57,0.07,0.609%,145144562.00,United States,,6838,Technology,Professional Services
DLO,DLocal Limited Class A Common Shares,$45.57,0.50,1.109%,13348171411.00,Uruguay,2021,2037908,,
DLPN,Dolphin Entertainment Inc. Common Stock,$9.94,0.61,6.538%,75547042.00,United States,,475686,,
DLTH,Duluth Holdings Inc. Class B Common Stock,$17.14,0.42,2.512%,566012815.00,United States,2015,112078,Consumer Services,Department/Specialty Retail Stores
DLTR,Dollar Tree Inc. Common Stock,$99.34,-2.15,-2.118%,23042297644.00,United States,1995,3684990,Consumer Services,Department/Specialty Retail Stores
DMAC,DiaMedica Therapeutics Inc. Common Stock,$7.225,-0.005,-0.069%,135389810.00,United States,2018,102937,Health Care,Major Pharmaceuticals
DMLP,Dorchester Minerals L.P. Common Units Representing Limited Partnership Interests,$16.81,0.26,1.571%,582967001.00,United States,,46161,Energy,Oil & Gas Production
DMRC,Digimarc Corporation Common Stock,$33.79,0.16,0.476%,571552139.00,United States,,154768,Technology,EDP Services
DMTK,DermTech Inc. Common Stock,$45.00,-0.77,-1.682%,1302240960.00,United States,2017,785329,Health Care,Managed Health Care
DNAY,Codex DNA Inc. Common Stock,$19.40,-0.85,-4.198%,547641320.00,United States,2021,204959,,
DNLI,Denali Therapeutics Inc. Common Stock,$73.44,2.41,3.393%,8900355902.00,United States,2017,376496,Health Care,Biotechnology: Biological Products (No Diagnostic Substances)
DOCU,DocuSign Inc. Common Stock,$276.72,1.92,0.699%,53914775790.00,United States,2018,2249004,Technology,EDP Services
DOGZ,Dogness (International) Corporation Class A Common Stock,$2.09,-0.01,-0.476%,61393361.00,China,2017,220734,Consumer Durables,Miscellaneous manufacturing industries
DOMO,Domo Inc. Class B Common Stock,$83.12,1.30,1.589%,2633290973.00,United States,2018,297336,Technology,Computer Software: Prepackaged Software
DOOO,BRP Inc. (Recreational Products) Common Subordinate Voting Shares,$77.61,0.07,0.09%,6518594750.00,Canada,,61179,,
DORM,Dorman Products Inc. Common Stock,$98.87,0.36,0.365%,3172004586.00,United States,,128993,Capital Goods,Auto Parts:O.E.M.
DOX,Amdocs Limited Ordinary Shares,$77.17,-0.65,-0.835%,9851059180.00,Guernsey,,562963,Technology,EDP Services
DOYU,DouYu International Holdings Limited ADS,$7.11,-0.77,-9.772%,2306553607.00,China,2019,13455298,Technology,Computer Software: Programming Data Processing
DRIO,DarioHealth Corp. Common Stock,$22.56,0.77,3.534%,370925113.00,Israel,,316680,Health Care,Medical/Dental Instruments
DRNA,Dicerna Pharmaceuticals Inc. Common Stock,$38.28,1.24,3.348%,2943736134.00,United States,2014,415986,Health Care,Biotechnology: Commercial Physical & Biological Resarch
DRRX,DURECT Corporation Common Stock,$1.70,0.02,1.19%,386590509.00,United States,2000,459452,Health Care,Major Pharmaceuticals
DRTT,DIRTT Environmental Solutions Ltd. Common Shares,$3.95,0.20,5.333%,334544906.00,Canada,,199472,,
DRVN,Driven Brands Holdings Inc. Common Stock,$29.58,0.15,0.51%,4952042227.00,United States,2021,240525,,
DSAC,Duddell Street Acquisition Corp. Class A Ordinary Shares,$9.70,0.00,0.00%,212187500.00,Hong Kong,2020,36950,Finance,Business Services
DSACU,Duddell Street Acquisition Corp. Unit,$10.15,0.02,0.197%,0.00,Hong Kong,2020,9699,Finance,Business Services
DSACW,Duddell Street Acquisition Corp. Warrant,$1.06,0.03,2.913%,0.00,Hong Kong,2020,150,Finance,Business Services
DSEY,Diversey Holdings Ltd. Ordinary Shares,$17.20,0.09,0.526%,5181416167.00,United States,2021,483673,Consumer Durables,Specialty Chemicals
DSGN,Design Therapeutics Inc. Common Stock,$22.57,-0.23,-1.009%,1255282958.00,United States,2021,136899,Health Care,Major Pharmaceuticals
DSGX,Descartes Systems Group Inc. (The) Common Stock,$67.47,0.27,0.402%,5702190279.00,Canada,,63754,,
DSKE,Daseke Inc. Common Stock,$6.72,-0.03,-0.444%,438101456.00,United States,2015,418069,,
DSKEW,Daseke Inc. Warrant,$0.115,-0.0002,-0.174%,0.00,United States,2015,84942,,
DSP,Viant Technology Inc. Class A Common Stock,$29.48,-0.01,-0.034%,1737420279.00,United States,2021,472335,Technology,EDP Services
DSPG,DSP Group Inc. Common Stock,$14.96,0.47,3.244%,362432659.00,United States,1994,122780,Technology,Semiconductors
DSWL,Deswell Industries Inc. Common Shares,$5.24,-0.21,-3.853%,83395852.00,Macau,1995,109932,Consumer Non-Durables,Plastic Products
DTEA,DAVIDsTEA Inc. Common Stock,$4.44,-0.14,-3.057%,116575614.00,Canada,2015,235269,Consumer Services,Restaurants
DTIL,Precision BioSciences Inc. Common Stock,$11.28,0.58,5.421%,648378077.00,United States,2019,790946,Health Care,Biotechnology: Biological Products (No Diagnostic Substances)
DTOC,Digital Transformation Opportunities Corp. Class A Common Stock,$9.73,-0.04,-0.409%,405619375.00,United States,2021,2853,,
DTOCU,Digital Transformation Opportunities Corp. Units,$9.90,-0.06,-0.602%,0.00,United States,2021,2844,Finance,Business Services
DTOCW,Digital Transformation Opportunities Corp. Warrant,$0.85,0.00,0.00%,0.00,United States,2021,18874,Finance,Business Services
DTSS,Datasea Inc. Common Stock,$2.45,0.00,0.00%,52611638.00,China,,30900,Technology,Retail: Computer Software & Peripheral Equipment
DTST,Data Storage Corporation Common Stock,$5.70,0.37,6.942%,27695553.00,United States,,107974,Technology,EDP Services
DTSTW,Data Storage Corporation Warrant,$1.03,-0.06,-5.505%,0.00,United States,,21060,,
DUNE,Dune Acquisition Corporation Class A Common Stock,$9.78,0.00,0.00%,,United States,2021,18948,,
DUNEU,Dune Acquisition Corporation Unit,$10.12,0.1199,1.199%,0.00,United States,2020,6474,,
DUNEW,Dune Acquisition Corporation Warrant,$0.7403,-0.029,-3.77%,0.00,United States,2021,11390,Finance,Business Services
DUO,Fangdd Network Group Ltd. American Depositary Shares,$2.93,-0.05,-1.678%,233951016.00,China,2019,71445,Technology,Computer Software: Programming Data Processing
DUOT,Duos Technologies Group Inc. Common Stock,$10.83,0.90,9.063%,38677114.00,United States,,85637,Technology,Computer Software: Prepackaged Software
DVAX,Dynavax Technologies Corporation Common Stock,$9.42,0.17,1.838%,1106892032.00,United States,2004,2011497,Health Care,Major Pharmaceuticals
DWSN,Dawson Geophysical Company Common Stock,$2.71,-0.03,-1.095%,63625575.00,United States,,7933,Energy,Oil & Gas Production
DXCM,DexCom Inc. Common Stock,$425.00,-6.72,-1.557%,41099996025.00,United States,2005,1190857,Health Care,Medical/Dental Instruments
DXPE,DXP Enterprises Inc. Common Stock,$32.66,1.43,4.579%,627298105.00,United States,,147123,Capital Goods,Industrial Machinery/Components
DXYN,Dixie Group Inc. (The) Common Stock,$2.72,0.01,0.369%,42868810.00,United States,,36203,Consumer Durables,Home Furnishings
