Symbol,Name,Last Sale,Net Change,% Change,Market Cap,Country,IPO Year,Volume,Sector,Industry
IIN,Intricon Corporation Common Stock,$21.43,0.76,3.677%,194418382.00,United States,,71962,Health Care,Medical/Dental Instruments
IIVI,II-VI Incorporated Common Stock,$71.31,1.25,1.784%,7479297864.00,United States,1987,906017,Capital Goods,Industrial Machinery/Components
IIVIP,II-VI Incorporated 6.00% Series A Mandatory Convertible Preferred Stock,$297.95,14.96,5.286%,0.00,United States,,788,Capital Goods,Industrial Machinery/Components
IKNA,Ikena Oncology Inc. Common Stock,$14.88,0.42,2.905%,533466466.00,United States,2021,74982,Health Care,Major Pharmaceuticals
IKNX,Ikonics Corporation,$11.30,-0.01,-0.088%,22349750.00,United States,,7793,Miscellaneous,Industrial Machinery/Components
IKT,Inhibikase Therapeutics Inc. Common Stock,$3.05,0.15,5.172%,76656702.00,United States,2020,1741571,Health Care,Biotechnology: Biological Products (No Diagnostic Substances)
ILMN,Illumina Inc. Common Stock,$468.07,-1.06,-0.226%,68338220000.00,United States,2000,454679,Health Care,Medical Specialities
ILPT,Industrial Logistics Properties Trust Common Shares of Beneficial Interest,$26.05,0.13,0.502%,1701093342.00,United States,2018,185715,Consumer Services,Real Estate Investment Trusts
IMAB,I-MAB American Depositary Shares,$81.28,2.29,2.899%,6115663583.00,China,2020,489236,Health Care,Major Pharmaceuticals
IMAC,IMAC Holdings Inc. Common Stock,$2.12,0.02,0.952%,53425020.00,United States,2019,124709,Health Care,Medical Specialities
IMACW,IMAC Holdings Inc. Warrant,$0.62,-0.0699,-10.132%,0.00,United States,2019,900,Health Care,Medical Specialities
IMBI,iMedia Brands Inc. Class A Common Stock,$8.22,0.01,0.122%,175601123.00,United States,,216364,Consumer Services,Catalog/Specialty Distribution
IMCC,IM Cannabis Corp. Common Shares,$5.24,-0.04,-0.758%,299034491.00,Canada,,77894,,
IMCR,Immunocore Holdings plc American Depositary Shares,$36.68,0.18,0.493%,1606073708.00,United Kingdom,2021,45834,Health Care,Biotechnology: Biological Products (No Diagnostic Substances)
IMGN,ImmunoGen Inc. Common Stock,$6.76,0.24,3.681%,1351608948.00,United States,1989,979960,Health Care,Major Pharmaceuticals
IMKTA,Ingles Markets Incorporated Class A Common Stock,$59.85,-0.92,-1.514%,1136813404.00,United States,1987,63307,Consumer Services,Food Chains
IMMP,Immutep Limited American Depositary Shares,$4.08,-0.20,-4.673%,264679914.00,Australia,,686820,Health Care,Major Pharmaceuticals
IMMR,Immersion Corporation Common Stock,$8.69,0.05,0.579%,268395351.00,United States,1999,409660,Technology,Computer peripheral equipment
IMNM,Immunome Inc. Common Stock,$16.78,-0.36,-2.10%,197286739.00,United States,2020,52827,Consumer Durables,Specialty Chemicals
IMOS,ChipMOS TECHNOLOGIES INC. American Depositary Shares,$34.49,0.48,1.411%,1254125587.00,Taiwan,,13980,Technology,Semiconductors
IMPL,Impel NeuroPharma Inc. Common Stock,$7.33,-0.02,-0.272%,163285066.00,United States,2021,310930,Health Care,Major Pharmaceuticals
IMRA,IMARA Inc. Common Stock,$7.85,0.07,0.90%,138477862.00,United States,2020,67930,Health Care,Biotechnology: Biological Products (No Diagnostic Substances)
IMTE,Integrated Media Technology Limited Ordinary Shares,$4.47,0.11,2.523%,37729183.00,Australia,,29026,Consumer Non-Durables,Consumer Electronics/Appliances
IMTX,Immatics N.V. Ordinary Shares,$11.62,-0.07,-0.599%,730998130.00,Germany,,67988,Health Care,Biotechnology: Biological Products (No Diagnostic Substances)
IMTXW,Immatics N.V. Warrants,$3.20,0.02,0.629%,0.00,Germany,,5947,Health Care,Biotechnology: Biological Products (No Diagnostic Substances)
IMUX,Immunic Inc. Common Stock,$13.15,1.05,8.678%,286005123.00,United States,2014,175240,Health Care,Major Pharmaceuticals
IMV,IMV Inc. Common Shares,$2.21,-0.02,-0.897%,149829012.00,Canada,,89337,,
IMVT,Immunovant Inc. Common Stock,$11.00,0.00,0.00%,899928997.00,United States,2019,687952,Health Care,Major Pharmaceuticals
IMXI,International Money Express Inc. Common Stock,$15.55,0.30,1.967%,608675018.00,United States,2017,139761,Technology,EDP Services
INBK,First Internet Bancorp Common Stock,$31.02,0.26,0.845%,305671142.00,United States,,22379,Finance,Major Banks
INBKZ,First Internet Bancorp 6.0% Fixed-to-Floating Rate Subordinated Notes Due 2029,$26.21,0.01,0.038%,0.00,United States,,2050,Finance,Major Banks
INBX,Inhibrx Inc. Common Stock,$26.07,-0.68,-2.542%,985726279.00,United States,2020,226237,Health Care,Major Pharmaceuticals
INCY,Incyte Corp. Common Stock,$86.13,1.00,1.175%,18942009074.00,United States,,1415311,Health Care,Biotechnology: Commercial Physical & Biological Resarch
INDB,Independent Bank Corp. Common Stock,$78.76,0.85,1.091%,2601517937.00,United States,,229187,Finance,Major Banks
INDI,indie Semiconductor Inc. Class A Common Stock,$9.74,0.88,9.932%,1317917812.00,United States,,762447,,
INDIW,indie Semiconductor Inc. Warrant,$2.16,0.22,11.34%,0.00,United States,,229224,,
INDT,INDUS Realty Trust Inc. (MD) Common Stock,$68.72,0.08,0.117%,530313477.00,United States,,11055,Finance,Real Estate
INFI,Infinity Pharmaceuticals Inc. Common Stock,$3.04,-0.07,-2.251%,269487613.00,United States,,3361656,Health Care,Major Pharmaceuticals
INFN,Infinera Corporation Common Stock,$10.74,0.12,1.13%,2201663377.00,United States,2007,1366588,Public Utilities,Telecommunications Equipment
INGN,Inogen Inc Common Stock,$67.72,-1.05,-1.527%,1516613779.00,United States,2014,74222,Health Care,Industrial Specialties
INKA,KludeIn I Acquisition Corp. Class A Common Stock,$9.77,0.00,0.00%,210665625.00,United States,2021,206,,
INKAW,KludeIn I Acquisition Corp. Warrant,$0.7016,0.00,0.00%,0.00,United States,2021,10,Finance,Business Services
INM,InMed Pharmaceuticals Inc. Common Shares,$2.89,0.12,4.332%,23266543.00,Canada,,30127,,
INMB,INmune Bio Inc. Common stock,$19.33,0.39,2.059%,292369555.00,United States,2019,154970,Health Care,Major Pharmaceuticals
INMD,InMode Ltd. Ordinary Shares,$95.91,1.01,1.064%,3662884519.00,Israel,2019,338871,Health Care,Medical/Nursing Services
INNV,InnovAge Holding Corp. Common Stock,$21.73,-0.48,-2.161%,2944773827.00,United States,2021,184792,Health Care,Hospital/Nursing Management
INO,Inovio Pharmaceuticals Inc. Common Stock,$8.89,0.20,2.301%,1861559421.00,United States,,3459746,Health Care,Biotechnology: Biological Products (No Diagnostic Substances)
INOD,Innodata Inc. Common Stock,$7.42,0.00,0.00%,195270752.00,United States,1993,66228,Technology,EDP Services
INOV,Inovalon Holdings Inc. Class A Common Stock,$32.94,-0.02,-0.061%,5135123457.00,United States,2015,250383,Technology,EDP Services
INPX,Inpixon Common Stock,$1.14,-0.01,-0.87%,127429913.00,United States,2014,1563288,Technology,Computer Software: Prepackaged Software
INSE,Inspired Entertainment Inc. Common Stock,$12.49,0.35,2.883%,289996854.00,United States,2014,319207,,
INSG,Inseego Corp. Common Stock,$10.55,0.15,1.442%,1086933130.00,United States,,1573486,Capital Goods,Telecommunications Equipment
INSM,Insmed Inc. Common Stock,$27.64,-0.20,-0.718%,3178379073.00,United States,,576511,Health Care,Major Pharmaceuticals
INTC,Intel Corporation Common Stock,$56.07,0.81,1.466%,226410660000.00,United States,,21181749,Technology,Semiconductors
INTG,Intergroup Corporation (The) Common Stock,$41.70,-4.30,-9.348%,93270974.00,United States,,897,Consumer Services,Hotels/Resorts
INTU,Intuit Inc. Common Stock,$482.62,4.03,0.842%,131880386957.00,United States,1993,1088491,Technology,Computer Software: Prepackaged Software
INTZ,Intrusion Inc. Common Stock,$14.80,0.73,5.188%,260776089.00,United States,,61528,Miscellaneous,Diversified Manufacture
INVA,Innoviva Inc. Common Stock,$13.46,0.21,1.585%,934161042.00,United States,,396374,Health Care,Major Pharmaceuticals
INVE,Identiv Inc. Common Stock,$16.87,0.31,1.872%,370859857.00,United States,,270150,Technology,Computer peripheral equipment
INVO,INVO BioScience Inc. Common Stock,$4.75,0.23,5.088%,49632916.00,United States,,32723,Health Care,Medical/Dental Instruments
INVZ,Innoviz Technologies Ltd. Ordinary shares,$10.50,-0.15,-1.408%,1363120112.00,Israel,,161532,Capital Goods,Auto Parts:O.E.M.
INVZW,Innoviz Technologies Ltd. Warrant,$2.70,0.01,0.372%,0.00,Israel,,8873,Capital Goods,Auto Parts:O.E.M.
INZY,Inozyme Pharma Inc. Common Stock,$16.42,-0.70,-4.089%,385592387.00,United States,2020,27813,Health Care,Major Pharmaceuticals
IONS,Ionis Pharmaceuticals Inc. Common Stock,$38.44,0.66,1.747%,5418618796.00,United States,,1476243,Health Care,Major Pharmaceuticals
IOSP,Innospec Inc. Common Stock,$93.96,0.10,0.107%,2312190700.00,United States,,102844,Basic Industries,Industrial Specialties
IOVA,Iovance Biotherapeutics Inc. Common Stock,$25.99,1.25,5.053%,3972552839.00,United States,,2519525,Health Care,Major Pharmaceuticals
IPA,ImmunoPrecise Antibodies Ltd. Common Stock,$6.45,-0.04,-0.616%,123059550.00,Canada,,47776,,
IPAR,Inter Parfums Inc. Common Stock,$73.50,0.82,1.128%,2326424793.00,United States,,84695,Consumer Non-Durables,Package Goods/Cosmetics
IPDN,Professional Diversity Network Inc. Common Stock,$1.74,0.15,9.434%,23429138.00,United States,2013,797742,Technology,EDP Services
IPGP,IPG Photonics Corporation Common Stock,$210.75,4.29,2.078%,11291692058.00,United States,2006,319121,Technology,Semiconductors
IPHA,Innate Pharma S.A. ADS,$3.4243,-0.1757,-4.881%,270550399.00,France,2019,29433,Health Care,Major Pharmaceuticals
IPLDP,Interstate Power & Light Company Perp Prd Ser D,$26.39,0.00,0.00%,0.00,United States,,6,Public Utilities,Power Generation
IPSC,Century Therapeutics Inc. Common Stock,$25.21,-0.33,-1.292%,1382128368.00,United States,2021,201737,,
IPVI,InterPrivate IV InfraTech Partners Inc. Class A Common Stock,$9.81,0.00,0.00%,0.00,United States,2021,478,Finance,Business Services
IPVIU,InterPrivate IV InfraTech Partners Inc. Units,$9.98,0.00,0.00%,0.00,United States,2021,25540,Finance,Business Services
IPVIW,InterPrivate IV InfraTech Partners Inc. Warrant,$0.96,-0.0001,-0.01%,0.00,United States,2021,4984,Finance,Business Services
IPW,iPower Inc. Common Stock,$6.91,-0.20,-2.813%,175987307.00,United States,2021,77226,Consumer Services,Catalog/Specialty Distribution
IPWR,Ideal Power Inc. Common Stock,$13.30,0.36,2.782%,78098212.00,United States,2013,76360,Capital Goods,Industrial Machinery/Components
IQ,iQIYI Inc. American Depositary Shares,$15.60,0.53,3.517%,12312844565.00,China,2018,6045588,Technology,Internet and Information Services
IRBT,iRobot Corporation Common Stock,$93.81,1.62,1.757%,2635591387.00,United States,2005,359192,,
IRCP,IRSA Propiedades Comerciales S.A. American Depositary Shares,$10.48,0.03,0.287%,330156806.00,Argentina,,13079,Consumer Services,Building operators
IRDM,Iridium Communications Inc Common Stock,$41.29,0.56,1.375%,5511341180.00,United States,,649218,Consumer Services,Telecommunications Equipment
IRIX,IRIDEX Corporation Common Stock,$7.07,0.33,4.896%,110474406.00,United States,1996,65014,Health Care,Biotechnology: Electromedical & Electrotherapeutic Apparatus
IRMD,iRadimed Corporation Common Stock,$28.45,0.39,1.39%,350290084.00,United States,2014,4198,Health Care,Medical/Dental Instruments
IROQ,IF Bancorp Inc. Common Stock,$22.55,0.00,0.00%,73070479.00,United States,2011,45,Finance,Finance: Consumer Services
IRTC,iRhythm Technologies Inc. Common Stock,$66.44,2.89,4.548%,1946894642.00,United States,2016,542610,Health Care,Medical/Dental Instruments
IRWD,Ironwood Pharmaceuticals Inc. Class A Common Stock,$12.81,0.41,3.306%,2074793901.00,United States,2010,1761719,Health Care,Major Pharmaceuticals
ISAA,Iron Spark I Inc. Class A Common Stock,$9.95,0.0075,0.075%,203004875.00,United States,2021,205564,,
ISBC,Investors Bancorp Inc. Common Stock,$14.71,0.25,1.729%,3643227259.00,United States,,1097443,Finance,Savings Institutions
ISEE,IVERIC bio Inc. Common Stock,$6.06,0.20,3.413%,546946003.00,United States,2013,2070829,Health Care,Major Pharmaceuticals
ISIG,Insignia Systems Inc. Common Stock,$8.03,0.15,1.904%,14084861.00,United States,1991,8905,Technology,Advertising
ISLE,Isleworth Healthcare Acquisition Corporation Common stock,$9.74,0.00,0.00%,255102775.00,United States,2021,1701,,
ISLEW,Isleworth Healthcare Acquisition Corporation Warrant,$0.6899,-0.0101,-1.443%,0.00,United States,2021,1553,Consumer Services,Hotels/Resorts
ISNS,Image Sensing Systems Inc. Common Stock,$6.85,0.00,0.00%,36677208.00,United States,1995,86448,Capital Goods,Industrial Machinery/Components
ISPC,iSpecimen Inc. Common Stock,$6.31,-0.28,-4.249%,40967902.00,United States,2021,514220,,
ISRG,Intuitive Surgical Inc. Common Stock,$904.57,-0.85,-0.094%,107112746098.00,United States,2000,341009,Health Care,Medical/Dental Instruments
ISSC,Innovative Solutions and Support Inc. Common Stock,$6.535,0.375,6.088%,112675634.00,United States,2000,121538,Capital Goods,Military/Government/Technical
ISTR,Investar Holding Corporation Common Stock,$22.27,-0.02,-0.09%,231904881.00,United States,2014,107460,Finance,Commercial Banks
ISUN,iSun Inc. Common Stock,$11.18,-0.15,-1.324%,101601235.00,United States,2016,180578,Technology,Semiconductors
ITAC,Industrial Tech Acquisitions Inc. Class A common stock,$10.06,0.00,0.00%,97388204.00,United States,2020,5910,Finance,Business Services
ITACU,Industrial Tech Acquisitions Inc. Unit,$11.18,0.11,0.994%,0.00,United States,2020,211,Finance,Business Services
ITACW,Industrial Tech Acquisitions Inc. Warrant,$1.1301,0.0801,7.629%,0.00,United States,2020,45403,Finance,Business Services
ITCI,Intra-Cellular Therapies Inc. Common Stock,$43.78,0.49,1.132%,3555033454.00,United States,,558678,Health Care,Major Pharmaceuticals
ITHX,ITHAX Acquisition Corp. Class A Ordinary Shares,$9.68,-0.02,-0.206%,298749000.00,United States,2021,5817,Finance,Business Services
ITHXU,ITHAX Acquisition Corp. Unit,$9.99,0.00,0.00%,0.00,United States,2021,2,Finance,Business Services
ITHXW,ITHAX Acquisition Corp. Warrant,$0.6599,0.00,0.00%,0.00,United States,2021,40,Finance,Business Services
ITI,Iteris Inc. Common Stock,$6.95,0.14,2.056%,290842474.00,United States,,133442,Capital Goods,Telecommunications Equipment
ITIC,Investors Title Company Common Stock,$174.20,1.94,1.126%,329956052.00,United States,,1593,Finance,Specialty Insurers
ITMR,Itamar Medical Ltd. American Depository Shares,$23.31,0.21,0.909%,381983697.00,Israel,,10015,Health Care,Medical/Dental Instruments
ITOS,iTeos Therapeutics Inc. Common Stock,$23.81,0.62,2.674%,835826216.00,United States,2020,1133200,Consumer Durables,Specialty Chemicals
ITQ,Itiquira Acquisition Corp. Class A Ordinary Shares,$9.69,0.00,0.00%,278587500.00,United States,2021,14,Finance,Business Services
ITQRU,Itiquira Acquisition Corp. Unit,$9.98,-0.01,-0.10%,0.00,United States,2021,2700,Finance,Business Services
ITQRW,Itiquira Acquisition Corp. Warrant,$0.70,0.00,0.00%,0.00,United States,2021,3177,Finance,Business Services
ITRI,Itron Inc. Common Stock,$98.01,1.02,1.052%,4423447302.00,United States,1993,260401,Capital Goods,Electrical Products
ITRM,Iterum Therapeutics plc Ordinary Share,$2.03,0.02,0.995%,363651701.00,Ireland,2018,35126781,Health Care,Major Pharmaceuticals
ITRN,Ituran Location and Control Ltd. Ordinary Shares,$27.26,0.13,0.479%,567370722.00,Israel,2005,23785,Technology,Electronic Components
IVA,Inventiva S.A. American Depository Shares,$13.90,0.00,0.00%,536960628.00,France,2020,11703,Consumer Services,Other Consumer Services
IVAC,Intevac Inc. Common Stock,$6.55,0.15,2.344%,158000508.00,United States,1995,241037,,
IZEA,IZEA Worldwide Inc. Common Stock,$2.61,-0.09,-3.333%,161106423.00,United States,,2433798,Technology,Advertising
JACK,Jack In The Box Inc. Common Stock,$120.79,0.73,0.608%,2684937755.00,United States,,157425,Consumer Services,Restaurants
JAGX,Jaguar Health Inc. Common Stock,$1.69,0.01,0.595%,232071277.00,United States,2015,3880734,Health Care,Major Pharmaceuticals
JAKK,JAKKS Pacific Inc. Common Stock,$11.61,-0.14,-1.191%,74255389.00,United States,1996,415369,Consumer Non-Durables,Recreational Products/Toys
JAMF,Jamf Holding Corp. Common Stock,$34.24,0.60,1.784%,4036377401.00,United States,2020,1813541,Technology,Computer Software: Prepackaged Software
JAN,JanOne Inc. Common Stock (NV),$8.67,-0.13,-1.477%,24478965.00,United States,,371597,Public Utilities,Environmental Services
JANX,Janux Therapeutics Inc. Common Stock,$24.82,1.61,6.937%,1032797678.00,United States,2021,220238,,
JAZZ,Jazz Pharmaceuticals plc Common Stock (Ireland),$178.80,1.82,1.028%,10852095961.00,Ireland,2007,433852,Health Care,Major Pharmaceuticals
JBHT,J.B. Hunt Transport Services Inc. Common Stock,$160.49,1.25,0.785%,16959139753.00,United States,,570529,Transportation,Trucking Freight/Courier Services
JBLU,JetBlue Airways Corporation Common Stock,$17.37,0.05,0.289%,5499982710.00,United States,2002,6070869,Transportation,Air Freight/Delivery Services
JBSS,John B. Sanfilippo & Son Inc. Common Stock,$88.40,0.43,0.489%,1013801079.00,United States,1991,21317,Consumer Non-Durables,Specialty Foods
JCIC,Jack Creek Investment Corp. Class A Ordinary Shares,$9.65,-0.01,-0.104%,416156250.00,United States,2021,8987,Finance,Business Services
JCICU,Jack Creek Investment Corp. Units,$10.07,0.01,0.099%,0.00,United States,2021,11270,Finance,Business Services
JCICW,Jack Creek Investment Corp. Warrants,$0.80,-0.01,-1.235%,0.00,United States,2021,20350,Finance,Business Services
JCOM,j2 Global Inc. Common Stock,$138.84,0.44,0.318%,6263377570.00,United States,1999,402051,Technology,Telecommunications Equipment
JCS,Communications Systems Inc. Common Stock,$6.82,0.055,0.813%,64588299.00,United States,,6786,Public Utilities,Telecommunications Equipment
JCTCF,Jewett-Cameron Trading Company Common Shares,$9.885,-0.015,-0.152%,34490356.00,United States,,578,,
JD,JD.com Inc. American Depositary Shares,$74.90,1.76,2.406%,116767995899.00,China,2014,9779388,Miscellaneous,Business Services
JFIN,Jiayin Group Inc. American Depositary Shares,$5.58,0.32,6.084%,301459500.00,China,2019,194278,Finance,Finance: Consumer Services
JFU,9F Inc. American Depositary Shares,$2.32,0.00,0.00%,472144780.00,China,2019,873657,Finance,Finance: Consumer Services
JG,Aurora Mobile Limited American Depositary Shares,$3.30,0.25,8.197%,389114141.00,China,2018,910501,Technology,EDP Services
JJSF,J & J Snack Foods Corp. Common Stock,$175.84,1.88,1.081%,3347284613.00,United States,1986,51311,Consumer Non-Durables,Specialty Foods
JKHY,Jack Henry & Associates Inc. Common Stock,$164.45,0.13,0.079%,12199817809.00,United States,1985,453049,Technology,Retail: Computer Software & Peripheral Equipment
JMPNL,JMP Group LLC 7.25% Senior Notes due 2027,$25.45,0.0999,0.394%,0.00,United States,,7383,Finance,Investment Bankers/Brokers/Service
JMPNZ,JMP Group LLC 6.875% Senior Notes due 2029,$25.2301,-0.0095,-0.038%,0.00,United States,,2003,Finance,Investment Bankers/Brokers/Service
JNCE,Jounce Therapeutics Inc. Common Stock,$7.24,-0.23,-3.079%,370748505.00,United States,2017,753570,Health Care,Major Pharmaceuticals
JOAN,JOANN Inc. Common Stock,$14.50,-0.40,-2.685%,611318536.00,United States,2021,381755,Consumer Non-Durables,Department/Specialty Retail Stores
JOBS,51job Inc. American Depositary Shares,$77.90,0.05,0.064%,5253025559.00,China,2004,740437,Technology,Diversified Commercial Services
JOFF,JOFF Fintech Acquisition Corp. Class A Common Stock,$9.71,0.01,0.103%,401994000.00,United States,2021,1690,,
JOFFU,JOFF Fintech Acquisition Corp. Unit,$9.99,0.01,0.10%,0.00,United States,2021,815,,
JOFFW,JOFF Fintech Acquisition Corp. Warrant,$0.9099,-0.0202,-2.172%,0.00,United States,2021,857,Finance,Business Services
JOUT,Johnson Outdoors Inc. Class A Common Stock,$119.60,0.41,0.344%,1210135285.00,United States,,43141,Consumer Non-Durables,Recreational Products/Toys
JRJC,China Finance Online Co. Limited American Depositary Shares,$9.70,0.00,0.00%,23687012.00,China,2004,8269,Finance,Investment Bankers/Brokers/Service
JRSH,Jerash Holdings (US) Inc. Common Stock,$6.33,-0.09,-1.402%,71687250.00,United States,2018,6592,Basic Industries,Industrial Specialties
JRVR,James River Group Holdings Ltd. Common Shares,$37.76,0.48,1.288%,1407406957.00,Bermuda,2014,212132,Finance,Property-Casualty Insurers
JSM,Navient Corporation 6% Senior Notes due December 15 2043,$25.23,0.03,0.119%,0.00,United States,,28590,Finance,Finance: Consumer Services
JUGGU,Jaws Juggernaut Acquisition Corporation Unit,$10.07,0.02,0.199%,0.00,United States,2021,43669,,
JUPW,Jupiter Wellness Inc. Common Stock,$4.40,0.02,0.457%,50204827.00,United States,2020,162901,Health Care,Major Pharmaceuticals
JUPWW,Jupiter Wellness Inc. Warrant,$1.25,-0.0001,-0.008%,0.00,United States,2020,3019,Health Care,Major Pharmaceuticals
JVA,Coffee Holding Co. Inc. Common Stock,$5.31,0.01,0.189%,30312661.00,United States,2005,18832,Consumer Non-Durables,Specialty Foods
JWEL,Jowell Global Ltd. Ordinary Shares,$6.50,0.08,1.246%,165235551.00,China,2021,33427,Consumer Services,Other Consumer Services
JYAC,Jiya Acquisition Corp. Class A Common Stock,$9.90,0.00,0.00%,133126201.00,United States,2020,200,,
JYNT,The Joint Corp. Common Stock,$82.81,4.78,6.126%,1178113027.00,United States,2014,259291,,
JZXN,Jiuzi Holdings Inc. Ordinary Shares,$8.15,-0.24,-2.861%,164630000.00,China,2021,903352,Consumer Durables,Automotive Aftermarket
KAII,Kismet Acquisition Two Corp. Class A Ordinary Shares,$9.70,0.01,0.103%,283725000.00,United States,2021,273331,Finance,Business Services
KAIIU,Kismet Acquisition Two Corp. Unit,$9.98,0.00,0.00%,0.00,United States,2021,10,Finance,Business Services
KAIIW,Kismet Acquisition Two Corp. Warrant,$0.8706,0.0676,8.418%,0.00,United States,2021,400,Finance,Business Services
KAIR,Kairos Acquisition Corp. Class A Ordinary Shares,$9.71,-0.02,-0.206%,334995000.00,United States,2021,14426,Finance,Business Services
KAIRU,Kairos Acquisition Corp. Unit,$10.02,0.00,0.00%,0.00,United States,2021,6610,Finance,Business Services
KAIRW,Kairos Acquisition Corp. Warrant,$0.73,-0.02,-2.667%,0.00,United States,2021,5327,Finance,Business Services
KALA,Kala Pharmaceuticals Inc. Common Stock,$5.98,0.07,1.184%,335237993.00,United States,2017,1250005,Health Care,Major Pharmaceuticals
KALU,Kaiser Aluminum Corporation Common Stock,$136.61,3.55,2.668%,2164986810.00,United States,,88816,Basic Industries,Aluminum
KALV,KalVista Pharmaceuticals Inc. Common Stock,$28.00,1.21,4.517%,683837532.00,United Kingdom,2015,135488,Health Care,Major Pharmaceuticals
KARO,Karooooo Ltd. Ordinary Shares,$36.00,-0.34,-0.936%,775454184.00,Singapore,2021,9525,Technology,Computer Software: Prepackaged Software
KBAL,Kimball International Inc. Class B Common Stock,$13.39,0.34,2.605%,492547963.00,United States,,129314,Consumer Durables,Industrial Specialties
KBNT,Kubient Inc. Common Stock,$5.84,0.50,9.363%,81657631.00,United States,2020,187170,Technology,EDP Services
KBNTW,Kubient Inc. Warrant,$2.09,0.11,5.556%,0.00,United States,2020,581,Technology,EDP Services
KBSF,KBS Fashion Group Limited Common Stock,$4.01,0.08,2.036%,10391109.00,China,2013,20977,Consumer Non-Durables,Apparel
KC,Kingsoft Cloud Holdings Limited American Depositary Shares,$34.04,0.57,1.703%,7601958729.00,China,2020,783686,Technology,Computer Software: Prepackaged Software
KDMN,Kadmon Holdings Inc. Common Stock,$3.91,0.11,2.895%,672417808.00,United States,,1837266,Health Care,Major Pharmaceuticals
KDNY,Chinook Therapeutics Inc. Common Stock,$15.20,0.50,3.401%,678167699.00,United States,2015,330908,Health Care,Major Pharmaceuticals
KDP,Keurig Dr Pepper Inc. Common Stock,$34.59,0.10,0.29%,49028655171.00,United States,,4202358,Consumer Non-Durables,Beverages (Production/Distribution)
KE,Kimball Electronics Inc. Common Stock,$22.02,0.26,1.195%,549554483.00,United States,,55581,Capital Goods,Industrial Machinery/Components
KELYA,Kelly Services Inc. Class A Common Stock,$24.93,0.44,1.797%,981470317.00,United States,,75615,Technology,Diversified Commercial Services
KELYB,Kelly Services Inc. Class B Common Stock,$24.89,0.38,1.55%,979895555.00,United States,,2124,Technology,Diversified Commercial Services
KEQU,Kewaunee Scientific Corporation Common Stock,$14.25,0.35,2.518%,39369857.00,United States,,8318,Capital Goods,Medical Specialities
KERN,Akerna Corp. Common Stock,$4.30,0.08,1.896%,60452440.00,United States,2018,1901604,Health Care,Managed Health Care
KERNW,Akerna Corp Warrant,$0.975,0.0648,7.119%,0.00,United States,2018,27210,Health Care,Managed Health Care
KFFB,Kentucky First Federal Bancorp Common Stock,$7.15,0.07,0.989%,58821012.00,United States,,2181,Finance,Savings Institutions
KFRC,Kforce Inc. Common Stock,$61.83,0.55,0.898%,1355000493.00,United States,1995,48068,Technology,Diversified Commercial Services
KHC,The Kraft Heinz Company Common Stock,$40.37,0.23,0.573%,49378458116.00,United States,,4983814,Consumer Non-Durables,Farming/Seeds/Milling
KIDS,OrthoPediatrics Corp. Common Stock,$67.51,1.07,1.61%,1327180238.00,United States,2017,101220,Health Care,Medical/Dental Instruments
KIII,Kismet Acquisition Three Corp. Class A Ordinary Shares,$9.65,-0.01,-0.104%,351621875.00,United States,2021,508,Finance,Business Services
KIIIU,Kismet Acquisition Three Corp. Unit,$9.99,0.00,0.00%,0.00,United States,2021,2,Finance,Business Services
KIN,Kindred Biosciences Inc. Common Stock,$9.19,-0.02,-0.217%,416587929.00,United States,2013,612749,Health Care,Major Pharmaceuticals
KINS,Kingstone Companies Inc. Common Stock,$8.11,0.01,0.123%,86620096.00,United States,,11802,Finance,Specialty Insurers
KINZ,KINS Technology Group Inc. Class A Common Stock,$9.89,0.00,0.00%,341205000.00,United States,2021,25156,,
KINZU,KINS Technology Group Inc. Unit,$10.26,0.00,0.00%,0.00,United States,2020,12600,,
KINZW,KINS Technology Group Inc. Warrant,$0.79,0.01,1.282%,0.00,United States,2021,12486,Finance,Business Services
KIRK,Kirkland's Inc. COMMONSTOCK,$23.24,0.51,2.244%,331229936.00,United States,2002,448976,Miscellaneous,Diversified Commercial Services
