Symbol,Name,Last Sale,Net Change,% Change,Market Cap,Country,IPO Year,Volume,Sector,Industry
PSACU,Property Solutions Acquisition Corp. Unit,$19.73,1.86,10.409%,0.00,United States,2020,4128,,
PSACW,Property Solutions Acquisition Corp. Warrant,$3.85,0.30,8.451%,0.00,United States,2020,634110,Capital Goods,Auto Manufacturing
PSAG,Property Solutions Acquisition Corporation II Class A Common Stock,$9.68,-0.02,-0.206%,0.00,United States,2021,938,,
PSAGU,Property Solutions Acquisition Corporation II Units,$9.99,0.03,0.301%,0.00,United States,2021,3177,,
PSAGW,Property Solutions Acquisition Corporation II Warrant,$1.10,0.1275,13.111%,0.00,United States,2021,9850,Finance,Business Services
PSEC,Prospect Capital Corporation Common Stock,$8.97,0.06,0.673%,3478189933.00,United States,2004,1820458,Finance,Finance/Investors Services
PSHG,Performance Shipping Inc. Common Shares,$5.56,-0.04,-0.714%,28259957.00,Greece,,43640,Transportation,Marine Transportation
PSMT,PriceSmart Inc. Common Stock,$89.80,1.32,1.492%,2761304831.00,United States,,76775,Consumer Services,Department/Specialty Retail Stores
PSNL,Personalis Inc. Common Stock,$26.19,-0.16,-0.607%,1149960446.00,United States,2019,415727,Health Care,Biotechnology: In Vitro & In Vivo Diagnostic Substances
PSTI,Pluristem Therapeutics Inc. Common Stock,$4.08,0.13,3.291%,129500196.00,Israel,,184983,Health Care,Biotechnology: Biological Products (No Diagnostic Substances)
PSTV,PLUS THERAPEUTICS Inc. Common Stock ,$2.79,0.07,2.574%,58886345.00,United States,,193433,Health Care,Medical/Dental Instruments
PSTX,Poseida Therapeutics Inc. Common Stock,$9.31,0.29,3.215%,578660359.00,United States,2020,63578,Consumer Durables,Specialty Chemicals
PT,Pintec Technology Holdings Limited American Depositary Shares,$0.9299,0.0299,3.322%,40298044.00,China,2018,103910,Technology,Computer Software: Programming Data Processing
PTC,PTC Inc. Common Stock,$137.74,2.03,1.496%,16095580978.00,United States,,527474,Technology,Computer Software: Prepackaged Software
PTCT,PTC Therapeutics Inc. Common Stock,$44.14,0.72,1.658%,3109923779.00,United States,2013,326756,Health Care,Major Pharmaceuticals
PTE,PolarityTE Inc. Common Stock,$1.11,-0.01,-0.893%,89502737.00,United States,,670325,Consumer Durables,Specialty Chemicals
PTEN,Patterson-UTI Energy Inc. Common Stock,$10.97,0.32,3.005%,2068020663.00,United States,1993,1550477,Energy,Oil & Gas Production
PTGX,Protagonist Therapeutics Inc. Common Stock,$42.88,-0.39,-0.901%,2034590694.00,United States,2016,373011,Health Care,Major Pharmaceuticals
PTIC,PropTech Investment Corporation II Class A Common Stock,$9.82,0.00,0.00%,282325000.00,United States,2021,13,,
PTICU,PropTech Investment Corporation II Unit,$10.08,0.00,0.00%,0.00,United States,2020,3,,
PTICW,PropTech Investment Corporation II Warrant,$0.96,0.0099,1.042%,0.00,United States,2021,250,Finance,Business Services
PTIX,Protagenic Therapeutics Inc. Common Stock,$3.11,0.05,1.634%,45542156.00,United States,,1818747,Miscellaneous,Business Services
PTIXW,Protagenic Therapeutics Inc. Warrant,$0.69,0.0299,4.53%,0.00,United States,,37547,,
PTMN,Portman Ridge Finance Corporation Common Stock,$2.40,0.02,0.84%,220389358.00,United States,,354359,Finance,Finance/Investors Services
PTNR,Partner Communications Company Ltd. American Depositary Shares,$4.85,-0.15,-3.00%,891941738.00,Israel,,733,Public Utilities,Telecommunications Equipment
PTOC,Pine Technology Acquisition Corp. Class A Common Stock,$9.84,0.08,0.82%,424350000.00,United States,2021,2748,Finance,Business Services
PTOCU,Pine Technology Acquisition Corp. Unit,$9.98,0.00,0.00%,0.00,United States,2021,22,Finance,Business Services
PTOCW,Pine Technology Acquisition Corp. Warrant,$0.7499,0.0299,4.153%,0.00,United States,2021,2323,Finance,Business Services
PTON,Peloton Interactive Inc. Class A Common Stock,$121.85,4.37,3.72%,36347035315.00,United States,2019,12757879,Consumer Services,Other Consumer Services
PTPI,Petros Pharmaceuticals Inc. Common Stock,$3.18,-0.15,-4.505%,31158470.00,United States,,51519,Health Care,Major Pharmaceuticals
PTRA,Proterra Inc. Common Stock,$17.85,0.22,1.248%,0.00,United States,2020,1344369,,
PTRAW,Proterra Inc. Warrant,$5.58,0.02,0.36%,0.00,United States,2020,266593,,
PTRS,Partners Bancorp Common Stock,$8.24,0.36,4.569%,146067580.00,United States,,71548,Finance,Major Banks
PTSI,P.A.M. Transportation Services Inc. Common Stock,$54.95,0.96,1.778%,314657053.00,United States,1986,2175,Transportation,Trucking Freight/Courier Services
PTVE,Pactiv Evergreen Inc. Common stock,$16.33,0.55,3.485%,2892985404.00,United States,2020,195429,Consumer Durables,Containers/Packaging
PUBM,PubMatic Inc. Class A Common Stock,$40.48,4.65,12.978%,1936016882.00,United States,2020,3314902,Technology,Computer Software: Prepackaged Software
PUCK,Goal Acquisitions Corp. Common Stock,$9.66,0.01,0.104%,320337675.00,United States,2021,10801,,
PUCKU,Goal Acquisitions Corp. Unit,$10.29,-0.01,-0.097%,0.00,United States,2021,1687,,
PUCKW,Goal Acquisitions Corp. Warrant,$0.6489,0.0189,3.00%,0.00,United States,2021,32469,Finance,Business Services
PULM,Pulmatrix Inc. Common Stock,$1.04,0.03,2.97%,58499024.00,United States,2014,341576,Health Care,Major Pharmaceuticals
PUYI,Puyi Inc. American Depository Shares,$5.40,-0.045,-0.826%,325699250.00,China,2019,52406,Finance,Investment Managers
PVAC,Penn Virginia Corporation Common Stock,$24.64,0.55,2.283%,932819395.00,United States,,214211,Energy,Oil & Gas Production
PVBC,Provident Bancorp Inc. (MD) Common Stock,$16.32,0.05,0.307%,299229517.00,United States,2015,36756,Finance,Major Banks
PWFL,PowerFleet Inc. Common Stock,$7.01,-0.01,-0.142%,252292718.00,United States,,228500,Capital Goods,Telecommunications Equipment
PWOD,Penns Woods Bancorp Inc. Common Stock,$24.59,0.66,2.758%,173625785.00,United States,,71252,Finance,Major Banks
PXLW,Pixelworks Inc.  Common Stock,$3.36,0.04,1.205%,175433735.00,United States,2000,613446,Technology,Semiconductors
PXS,Pyxis Tankers Inc. Common Stock,$0.9094,0.0406,4.673%,19606559.00,Greece,,1745393,Transportation,Marine Transportation
PXSAP,Pyxis Tankers Inc. 7.75% Series A Cumulative Convertible Preferred Shares,$24.30,0.00,0.00%,0.00,Greece,,5,Transportation,Marine Transportation
PXSAW,Pyxis Tankers Inc. Warrant,$0.3701,0.0101,2.806%,0.00,Greece,,11838,Transportation,Marine Transportation
PYPD,PolyPid Ltd. Ordinary Shares,$8.98,0.04,0.447%,168331375.00,Israel,2020,34247,Health Care,Medical/Dental Instruments
PYPL,PayPal Holdings Inc. Common Stock,$293.21,5.09,1.767%,344442012713.00,United States,,7143132,Miscellaneous,Business Services
PYR,PyroGenesis Canada Inc. Common Shares,$5.56,0.04,0.725%,926871210.00,Canada,,170348,,
PZZA,Papa John's International Inc. Common Stock,$104.58,-0.31,-0.296%,3821140903.00,United States,1993,202386,Consumer Services,Restaurants
QADA,QAD Inc. Class A Common Stock,$73.63,1.66,2.307%,1525018670.00,United States,,42663,Technology,Computer Software: Prepackaged Software
QADB,QAD Inc. Class B Common Stock,$48.86,0.00,0.00%,1011984411.00,United States,,83,Technology,Computer Software: Prepackaged Software
QCOM,QUALCOMM Incorporated Common Stock,$137.92,2.40,1.771%,155573760000.00,United States,1991,7939977,Technology,Computer peripheral equipment
QCRH,QCR Holdings Inc. Common Stock,$49.83,1.42,2.933%,789651924.00,United States,,71240,Finance,Major Banks
QDEL,Quidel Corporation Common Stock,$114.96,2.11,1.87%,4891641807.00,United States,,319084,Health Care,Biotechnology: In Vitro & In Vivo Diagnostic Substances
QELL,Qell Acquisition Corp. Class A Ordinary Shares,$9.95,0.02,0.201%,472003125.00,United States,2020,309167,Finance,Business Services
QELLU,Qell Acquisition Corp. Unit,$10.47,-0.02,-0.191%,0.00,United States,2020,5909,Finance,Business Services
QELLW,Qell Acquisition Corp. Warrant,$1.63,-0.01,-0.61%,0.00,United States,2020,63441,Finance,Business Services
QFIN,360 DigiTech Inc. American Depositary Shares,$42.92,-0.41,-0.946%,6540836363.00,China,2018,1768271,Finance,Finance: Consumer Services
QH,Quhuo Limited American Depository Shares,$3.52,0.02,0.571%,184428675.00,China,2020,66134,Miscellaneous,Business Services
QIPT,Quipt Home Medical Corp. Common Shares,$6.03,0.42,7.487%,185173449.00,United States,,163189,Capital Goods,Office Equipment/Supplies/Services
QIWI,QIWI plc American Depositary Shares,$10.78,0.08,0.748%,676045871.00,Cyprus,2013,163242,Miscellaneous,Business Services
QK,Q&K International Group Limited American Depositary Shares,$1.64,0.14,9.333%,88906583.00,China,2019,1171283,Finance,Real Estate
QLGN,Qualigen Therapeutics Inc. Common Stock,$2.11,0.09,4.455%,60837754.00,United States,2015,159502,Health Care,Biotechnology: Commercial Physical & Biological Resarch
QLI,Qilian International Holding Group Ltd. Ordinary Shares,$4.24,0.04,0.952%,151580000.00,China,2021,27915,Health Care,Major Pharmaceuticals
QLYS,Qualys Inc. Common Stock,$101.74,-0.35,-0.343%,3982295583.00,United States,2012,202017,Technology,EDP Services
QMCO,Quantum Corporation Common Stock,$6.89,-0.26,-3.636%,393329161.00,United States,,875059,Technology,Electronic Components
QNST,QuinStreet Inc. Common Stock,$18.85,0.35,1.892%,1010727028.00,United States,2010,185677,Technology,Advertising
QQQX,Nuveen NASDAQ 100 Dynamic Overwrite Fund Shares of Beneficial Interest,$28.97,0.07,0.242%,1218650572.00,United States,,115274,Finance,Finance Companies
QRHC,Quest Resource Holding Corporation Common Stock,$6.15,0.02,0.326%,115130989.00,United States,,66810,Technology,Diversified Commercial Services
QRTEA,Qurate Retail Inc. Series A Common Stock ,$13.06,0.17,1.319%,5376572262.00,United States,,2299213,Consumer Services,Catalog/Specialty Distribution
QRTEB,Qurate Retail Inc. Series B Common Stock ,$13.39,-0.008,-0.06%,5512427457.00,United States,,573,Consumer Services,Catalog/Specialty Distribution
QRTEP,Qurate Retail Inc. 8.0% Fixed Rate Cumulative Redeemable Preferred Stock,$108.25,-0.22,-0.203%,0.00,United States,,6393,Consumer Services,Catalog/Specialty Distribution
QRVO,Qorvo Inc. Common Stock,$182.89,5.01,2.817%,20591002047.00,United States,,895091,Capital Goods,Industrial Machinery/Components
QSI,Quantum-Si Incorporated Class A Common Stock,$11.00,0.45,4.265%,1500407260.00,United States,2020,848532,,
QSIAW,Quantum-Si Incorporated Warrant,$2.8301,-0.0099,-0.349%,0.00,United States,2020,33413,,
QTNT,Quotient Limited Ordinary Shares,$4.17,0.10,2.457%,423368858.00,Switzerland,2014,297301,Health Care,Biotechnology: In Vitro & In Vivo Diagnostic Substances
QTRX,Quanterix Corporation Common Stock,$62.96,-0.54,-0.85%,2287752210.00,United States,2017,345294,Health Care,Industrial Specialties
QTT,Qutoutiao Inc. American Depositary Shares,$1.91,0.00,0.00%,549109246.00,China,2018,698455,Technology,Computer Software: Prepackaged Software
QUIK,QuickLogic Corporation Common Stock,$7.20,0.35,5.109%,82442052.00,United States,1999,54766,Technology,Semiconductors
QUMU,Qumu Corporation Common Stock,$2.95,0.15,5.357%,51895730.00,United States,,509962,Technology,Retail: Computer Software & Peripheral Equipment
QURE,uniQure N.V. Ordinary Shares,$30.11,0.14,0.467%,1382793590.00,Netherlands,2014,415775,Health Care,Major Pharmaceuticals
RAAC,Revolution Acceleration Acquisition Corp Class A Common Stock,$9.93,-0.01,-0.101%,380649997.00,United States,2021,132763,,
RAACU,Revolution Acceleration Acquisition Corp Unit,$10.6406,0.0606,0.573%,0.00,United States,2020,1989,,
RAACW,Revolution Acceleration Acquisition Corp Warrant,$1.9501,-0.0499,-2.495%,0.00,United States,2021,6518,Finance,Business Services
RACA,Therapeutics Acquisition Corp. Class A Common Stock,$10.03,0.06,0.602%,174858005.00,United States,2020,1126734,Health Care,Major Pharmaceuticals
RACB,Research Alliance Corp. II Class A Common Stock,$10.00,-0.20,-1.961%,191865000.00,United States,2021,30151,,
RADA,RADA Electronic Industries Ltd. Ordinary Shares,$12.25,-0.31,-2.468%,532692046.00,Israel,,341416,,
RADI,Radius Global Infrastructure Inc. Class A Common Stock,$14.48,-0.30,-2.03%,886388972.00,United States,,502277,Consumer Services,Telecommunications Equipment
RAIL,FreightCar America Inc. Common Stock,$7.20,1.42,24.567%,111901824.00,United States,2005,13893993,Capital Goods,Railroads
RAIN,Rain Therapeutics Inc. Common Stock,$17.47,1.32,8.173%,462652070.00,United States,2021,297949,Health Care,Major Pharmaceuticals
RAMMU,Aries I Acquisition Corporation Unit,$10.04,-0.01,-0.10%,0.00,Cayman Islands,2021,38765,Finance,Business Services
RAND,Rand Capital Corporation Common Stock,$17.18,0.00,0.00%,44361663.00,United States,,164,Finance,Finance/Investors Services
RAPT,RAPT Therapeutics Inc. Common Stock,$34.94,0.12,0.345%,1026015441.00,United States,2019,182078,Health Care,Major Pharmaceuticals
RARE,Ultragenyx Pharmaceutical Inc. Common Stock,$93.20,-0.52,-0.555%,6289390716.00,United States,2014,622738,Health Care,Major Pharmaceuticals
RAVE,Rave Restaurant Group Inc. Common Stock,$1.40,0.02,1.449%,25206866.00,United States,,154337,Consumer Services,Restaurants
RAVN,Raven Industries Inc. Common Stock,$57.77,-0.29,-0.499%,2074961889.00,United States,,1046380,Capital Goods,Specialty Chemicals
RBB,RBB Bancorp Common Stock,$24.62,0.59,2.455%,481868155.00,United States,2017,71643,Finance,Commercial Banks
RBBN,Ribbon Communications Inc. Common Stock,$7.89,0.16,2.07%,1162729330.00,United States,,183977,Technology,EDP Services
RBCAA,Republic Bancorp Inc. Class A Common Stock,$46.96,0.49,1.054%,976353672.00,United States,1998,34609,Finance,Major Banks
RBCN,Rubicon Technology Inc. Common Stock,$9.79,-0.11,-1.111%,23901747.00,United States,2007,1889,Technology,Semiconductors
RBKB,Rhinebeck Bancorp Inc. Common Stock,$10.71,0.00,0.00%,119237536.00,United States,2019,417,Finance,Major Banks
RBNC,Reliant Bancorp Inc. Common Stock,$28.08,0.335,1.207%,460700698.00,United States,,49693,Finance,Major Banks
RCAT,Red Cat Holdings Inc. Common Stock,$2.57,0.05,1.984%,87043459.00,United States,,146212,Technology,Retail: Computer Software & Peripheral Equipment
RCEL,Avita Therapeutics Inc. Common Stock,$21.45,0.24,1.132%,532879840.00,Australia,,236853,Health Care,Medical Specialities
RCHG,Recharge Acquisition Corp. Class A Common Stock,$9.835,-0.065,-0.657%,246366750.00,United States,2020,40295,,
RCHGU,Recharge Acquisition Corp. Unit,$10.19,0.01,0.098%,0.00,United States,2020,15738,,
RCHGW,Recharge Acquisition Corp. Warrant,$0.751,0.0159,2.163%,0.00,United States,2020,39098,Finance,Business Services
RCII,Rent-A-Center Inc. Common Stock,$52.95,0.67,1.282%,3511079977.00,United States,1995,760106,Technology,Diversified Commercial Services
RCKT,Rocket Pharmaceuticals Inc. Common Stock,$43.50,0.51,1.186%,2757767499.00,United States,2015,257570,Health Care,Major Pharmaceuticals
RCKY,Rocky Brands Inc. Common Stock,$55.00,-0.09,-0.163%,400588870.00,United States,1993,41193,Consumer Non-Durables,Shoe Manufacturing
RCLF,Rosecliff Acquisition Corp I Class A Common Stock,$9.7017,0.0017,0.018%,306816263.00,United States,2021,200,,
RCLFU,Rosecliff Acquisition Corp I Unit,$9.95,0.015,0.151%,0.00,United States,2021,3158,,
RCLFW,Rosecliff Acquisition Corp I Warrants,$0.7489,0.0187,2.561%,0.00,United States,2021,13300,Finance,Business Services
RCM,R1 RCM Inc. Common Stock,$22.51,0.01,0.044%,6273186564.00,United States,,1431801,Consumer Services,Other Consumer Services
RCMT,RCM Technologies Inc. Common Stock,$4.20,0.31,7.969%,46574153.00,United States,,307987,Consumer Services,Military/Government/Technical
RCON,Recon Technology Ltd. Class A Ordinary Shares,$4.27,0.22,5.432%,30756093.00,China,2009,6512226,Energy,Oilfield Services/Equipment
RDCM,Radcom Ltd. Ordinary Shares,$10.72,0.43,4.179%,149475992.00,Israel,1997,29889,Technology,Computer peripheral equipment
RDFN,Redfin Corporation Common Stock,$63.30,3.02,5.01%,6585827646.00,United States,2017,1342039,Finance,Real Estate
RDHL,Redhill Biopharma Ltd. American Depositary Shares,$7.00,-0.02,-0.285%,327040091.00,Israel,,153360,Health Care,Major Pharmaceuticals
RDI,Reading International Inc Class A Common Stock,$6.79,0.01,0.147%,148085846.00,United States,,14970,Consumer Services,Movies/Entertainment
RDIB,Reading International Inc Class B Common Stock,$23.10,0.00,0.00%,503797209.00,United States,,15,Consumer Services,Movies/Entertainment
RDNT,RadNet Inc. Common Stock,$34.59,0.20,0.582%,1822894349.00,United States,,257526,Health Care,Medical Specialities
RDUS,Radius Health Inc. Common Stock,$20.29,1.08,5.622%,958553551.00,United States,2014,337913,Health Care,Major Pharmaceuticals
RDVT,Red Violet Inc. Common Stock ,$20.88,0.60,2.959%,255607782.00,United States,,86628,Technology,Computer Software: Prepackaged Software
RDWR,Radware Ltd. Ordinary Shares,$30.81,-0.03,-0.097%,1402931501.00,Israel,1999,371912,Technology,EDP Services
REAL,The RealReal Inc. Common Stock,$22.49,0.24,1.079%,2042309591.00,United States,2019,2115110,Consumer Services,Catalog/Specialty Distribution
REAX,The Real Brokerage Inc. Common Shares,$9.10,-0.005,-0.055%,326262901.00,Canada,,19693,,
REDU,RISE Education Cayman Ltd American Depositary Shares,$2.87,0.03,1.056%,162105940.00,China,2017,33416,Miscellaneous,Service to the Health Industry
REED,Reeds Inc. Common Stock,$1.07,0.00,0.00%,100135287.00,United States,,277511,Consumer Non-Durables,Beverages (Production/Distribution)
REFR,Research Frontiers Incorporated Common Stock,$2.39,-0.05,-2.049%,75644446.00,United States,,288908,Capital Goods,Industrial Machinery/Components
REG,Regency Centers Corporation Common Stock,$64.56,-0.26,-0.401%,10966301050.00,United States,1993,717976,Consumer Services,Real Estate Investment Trusts
REGI,Renewable Energy Group Inc. Common Stock,$64.36,0.61,0.957%,3067557985.00,United States,2012,777252,Basic Industries,Major Chemicals
REGN,Regeneron Pharmaceuticals Inc. Common Stock,$544.45,14.65,2.765%,58007774632.00,United States,1991,790027,Health Care,Major Pharmaceuticals
REKR,Rekor Systems Inc. Common Stock,$10.07,-0.92,-8.371%,412814716.00,United States,,633352,Technology,EDP Services
RELI,Reliance Global Group Inc. Common Stock,$3.73,0.14,3.90%,40767087.00,United States,,47217,Finance,Specialty Insurers
RELIW,Reliance Global Group Inc. Series A Warrants,$0.60,0.0501,9.111%,0.00,United States,,500,Consumer Services,Broadcasting
RELL,Richardson Electronics Ltd. Common Stock,$8.63,0.33,3.976%,113982054.00,United States,1983,48739,Technology,Electronic Components
REPH,Recro Pharma Inc. Common Stock,$2.31,0.27,13.235%,107090396.00,United States,2014,1278461,Health Care,Major Pharmaceuticals
REPL,Replimune Group Inc. Common Stock,$37.71,1.67,4.634%,1757623806.00,United States,2018,240036,Health Care,Major Pharmaceuticals
RESN,Resonant Inc. Common Stock,$3.40,0.02,0.592%,205438618.00,United States,2014,1023614,Technology,Semiconductors
RETA,Reata Pharmaceuticals Inc. Class A Common Stock,$142.35,1.29,0.915%,5164146538.00,United States,2016,287344,Health Care,Major Pharmaceuticals
RETO,ReTo Eco-Solutions Inc. Common Shares,$1.32,0.00,0.00%,33178200.00,China,2017,3246577,Capital Goods,Multi-Sector Companies
REVH,Revolution Healthcare Acquisition Corp. SAIL Class A Common Stock,$9.82,-0.10,-1.008%,567105000.00,United States,2021,5354,Finance,Business Services
REVHU,Revolution Healthcare Acquisition Corp. SAIL Units,$10.09,-0.0085,-0.084%,0.00,United States,2021,3653,Finance,Business Services
REVHW,Revolution Healthcare Acquisition Corp. SAIL Warrant.,$1.37,-0.01,-0.725%,0.00,United States,2021,874,,
REYN,Reynolds Consumer Products Inc. Common Stock,$29.80,0.08,0.269%,6250806340.00,United States,2020,420005,Capital Goods,Office Equipment/Supplies/Services
RFIL,RF Industries Ltd. Common Stock,$7.91,-0.13,-1.617%,79108353.00,United States,,19835,Capital Goods,Electrical Products
RGCO,RGC Resources Inc. Common Stock,$23.02,0.83,3.74%,189426262.00,United States,,78733,Public Utilities,Oil & Gas Production
RGEN,Repligen Corporation Common Stock,$192.87,-0.05,-0.026%,10589424357.00,United States,1986,242968,Health Care,Medical/Dental Instruments
RGLD,Royal Gold Inc. Common Stock,$111.97,1.79,1.625%,7345959357.00,United States,,484259,,
RGLS,Regulus Therapeutics Inc. Common Stock,$1.00,0.0163,1.657%,74923660.00,United States,2012,5542202,Health Care,Major Pharmaceuticals
RGNX,REGENXBIO Inc. Common Stock,$40.25,1.73,4.491%,1711001982.00,United States,2015,448298,Health Care,Biotechnology: Biological Products (No Diagnostic Substances)
RGP,Resources Connection Inc. Common Stock,$14.59,0.16,1.109%,478887891.00,United States,,92628,Miscellaneous,Business Services
RIBT,RiceBran Technologies Common Stock,$1.05,0.01,0.962%,47724564.00,United States,,362101,Consumer Non-Durables,Specialty Foods
RICK,RCI Hospitality Holdings Inc. Common Stock,$67.32,-0.61,-0.898%,605873941.00,United States,1995,33858,Consumer Services,Restaurants
RIDE,Lordstown Motors Corp. Class A Common Stock,$10.98,-0.20,-1.789%,1938841548.00,United States,2019,8271628,Capital Goods,Construction/Ag Equipment/Trucks
RIGL,Rigel Pharmaceuticals Inc. Common Stock,$4.30,0.07,1.655%,731706632.00,United States,2000,1385599,Health Care,Major Pharmaceuticals
RILY,B. Riley Financial Inc. Common Stock,$74.70,3.05,4.257%,2031459702.00,United States,,372908,Finance,Investment Managers
RILYG,B. Riley Financial Inc. 7.25% Senior Notes due 2027,$25.4811,0.0211,0.083%,0.00,United States,,8879,Miscellaneous,Business Services
RILYH,B. Riley Financial Inc. 7.375% Senior Notes due 2023,$25.8135,0.0229,0.089%,0.00,United States,,4603,Miscellaneous,Business Services
RILYI,B. Riley Financial Inc. 6.875% Senior Notes due 2023,$25.82,0.00,0.00%,0.00,United States,,121,Miscellaneous,Business Services
RILYK,B. Riley Financial Inc. 5.50% Senior Notes Due 2026,$25.09,-0.08,-0.318%,0.00,United States,,108876,Miscellaneous,Business Services
RILYL,B. Riley Financial Inc. Depositary Shares each representing 1/1000th in a share of 7.375% Series B Cumulative Perpetual Preferred Stock par value $0.0001,$27.50,-0.04,-0.145%,0.00,United States,,1672,Finance,Investment Managers
RILYM,B. Riley Financial Inc. 6.375% Senior Notes due 2025,$25.68,0.03,0.117%,0.00,United States,,41782,Miscellaneous,Business Services
RILYN,B. Riley Financial Inc. 6.50% Senior Notes Due 2026,$26.05,-0.04,-0.153%,0.00,United States,,31389,Miscellaneous,Business Services
RILYO,B. Riley Financial Inc. 6.75% Senior Notes due 2024,$25.89,-0.0716,-0.276%,0.00,United States,,11507,Miscellaneous,Business Services
RILYP,B. Riley Financial Inc. Depositary Shares each representing a 1/1000th fractional interest in a share of Series A Cumulative Perpetual Preferred Stock,$26.84,0.09,0.336%,0.00,United States,,4656,Finance,Investment Managers
RILYT,B. Riley Financial Inc. 6.00% Senior Notes Due 2028,$25.69,-0.07,-0.272%,0.00,United States,,7753,Miscellaneous,Business Services
RIOT,Riot Blockchain Inc.  Common Stock ,$34.02,1.54,4.741%,3264039783.00,United States,,9357315,Technology,Retail: Computer Software & Peripheral Equipment
RIVE,Riverview Financial Corporation Common Stock,$12.60,-0.35,-2.703%,117822109.00,United States,,1045,Finance,Major Banks
RKDA,Arcadia Biosciences Inc. Common Stock,$3.00,0.08,2.74%,64008747.00,United States,2015,353882,Basic Industries,Agricultural Chemicals
RLAY,Relay Therapeutics Inc. Common Stock,$35.00,0.86,2.519%,3233382600.00,United States,2020,487938,Health Care,Major Pharmaceuticals
RLMD,Relmada Therapeutics Inc. Common Stock,$33.30,1.14,3.545%,559314692.00,United States,,102040,Health Care,Major Pharmaceuticals
RMBI,Richmond Mutual Bancorporation Inc. Common Stock,$14.15,0.07,0.497%,182305812.00,United States,2019,82106,,
RMBL,RumbleOn Inc. Class B Common Stock,$41.77,1.47,3.648%,141728200.00,United States,,94594,Capital Goods,Automotive Aftermarket
RMBS,Rambus Inc. Common Stock,$23.67,0.59,2.556%,2662999362.00,United States,1997,754710,Technology,Semiconductors
RMCF,Rocky Mountain Chocolate Factory Inc. Common Stock,$7.32,-0.38,-4.935%,44791043.00,United States,,36687,Consumer Non-Durables,Specialty Foods
RMGB,RMG Acquisition Corp. II Class A Ordinary Shares,$9.95,-0.01,-0.10%,429093750.00,United States,2021,90945,Finance,Business Services
RMGBU,RMG Acquisition Corp. II Unit,$10.5951,0.0613,0.582%,0.00,United States,2020,500,Finance,Business Services
RMGBW,RMG Acquisition Corp. II Warrant,$1.75,0.05,2.941%,0.00,United States,2021,51878,Finance,Business Services
RMGC,RMG Acquisition Corp. III Class A Ordinary Shares,$9.76,0.01,0.103%,589260000.00,United States,2021,3852,Finance,Business Services
RMGCU,RMG Acquisition Corp. III Unit,$10.03,0.07,0.703%,0.00,United States,2021,1510,Finance,Business Services
RMGCW,RMG Acquisition Corp. III Warrant,$1.17,0.00,0.00%,0.00,United States,2021,2212,Finance,Business Services
RMNI,Rimini Street Inc. (DE) Common Stock,$6.60,0.26,4.101%,562755600.00,United States,2015,573619,Technology,EDP Services
RMR,The RMR Group Inc. Class A Common Stock,$39.46,0.30,0.766%,647664517.00,United States,,38553,Finance,Real Estate
RMRM,RMR Mortgage Trust Common Stock,$12.09,0.03,0.249%,123523627.00,United States,,8048,Consumer Services,Real Estate Investment Trusts
RMTI,Rockwell Medical Inc. (DE) Common Stock,$0.9198,0.0465,5.325%,86119707.00,United States,1998,1164979,Health Care,Biotechnology: Electromedical & Electrotherapeutic Apparatus
RNA,Avidity Biosciences Inc. Common Stock,$26.91,1.70,6.743%,1012226674.00,United States,2020,232740,Health Care,Major Pharmaceuticals
RNDB,Randolph Bancorp Inc. Common Stock,$23.0709,0.7109,3.179%,122411450.00,United States,2016,4375,Finance,Major Banks
RNLX,Renalytix AI plc American Depositary Shares,$31.78,0.31,0.985%,1144831375.00,United Kingdom,2020,49196,Health Care,Medical Specialities
RNST,Renasant Corporation Common Stock,$41.49,0.66,1.616%,2336474747.00,United States,,215292,Finance,Major Banks
RNWK,RealNetworks Inc. Common Stock,$2.43,0.09,3.846%,113984989.00,United States,1997,447388,Technology,EDP Services
